{"$schema":"https://json-schema.org/draft/2020-12/schema","additionalProperties":false,"description":"Review-only catalog change proposal; semantic and hash validation is enforced by dpslab.catalog_change_proposal.","properties":{"binding":{"type":"object"},"identity":{"type":"object"},"integrity":{"type":"object"},"operations":{"items":{"type":"object"},"minItems":1,"type":"array"},"review":{"type":"object"},"schema_version":{"const":"0.1"},"subject":{"type":"object"}},"required":["schema_version","identity","binding","subject","operations","review","integrity"],"title":"DpsLab catalog change proposal 0.1","type":"object"}
