{"binding":{"build_max":120500,"build_min":120500,"catalog_content_version":"0.1.0","catalog_id":"dpslab.synthetic.static.catalog","catalog_sha256":"decef73f2d25d82a174e27c50d9584be3f11037328ab660a6fe6f04e189d70e9","evidence_id":"synthetic.patch.120500.1","evidence_sha256":"758e833e0fefdcc291e505e051113bf1a0ba58008498a11a0ae3ad6494cac44b","interface_max":120500,"interface_min":120500,"source_revision":"synthetic-r1"},"identity":{"created_at":"2026-07-31T16:00:00Z","expires_at":"2026-08-01T16:00:00Z","proposal_id":"proposal.synthetic.patch.120500.1","status":"pending_review"},"integrity":{"hash_algorithm":"sha256","proposal_sha256":"9b0256a5f40445c8448e66713d7774067b887ce627d4b44e0b4b95c0648fd866"},"operations":[{"action":"replace","after_token":"synthetic-coefficient-b","before_token":"synthetic-coefficient-a","catalog_field":"guidance.synthetic.damage","citation_token":"section.synthetic.1","limitations":["requires_human_review","synthetic_fixture_only"],"operation_id":"proposal.synthetic-damage-change","parameter_family_id":"synthetic.role.damage","source_assertion_id":"synthetic-damage-change","subject_tokens":["class.synthetic","spec.synthetic"]}],"review":{"decided_at":null,"decision_id":null,"reviewer_id":null,"state":"pending_review"},"schema_version":"0.1","subject":{"class_id":1,"content_contexts":["synthetic_single_target"],"role":"damage","specialization_id":71}}
